search URL:,https://patents.google.com/?assignee=ATARA+BIOTHERAPEUTICS+INC
id,title,assignee,inventor/author,priority date,filing/creation date,publication date,grant date,result link,representative figure link
US-8410043-B2,Stabilized activin IIB receptor polypeptides and uses thereof ,"Atara Biotherapeutics, Inc.","Jeonghoon Sun, Lei-Ting Tony Tam, Mark Leo Michaels, Thomas C. Boone, Rohini Deshpande, Yue-Sheng Li, Hq Han",2008-11-26,2009-11-25,2013-04-02,2013-04-02,https://patents.google.com/patent/US8410043B2/en,https://patentimages.storage.googleapis.com/cc/16/ad/9c4064ec272790/US08410043-20130402-D00001.png
US-8501678-B2,Variant activin receptor polypeptides and uses thereof ,"Atara Biotherapeutics, Inc.","Jeonghoon Sun, Lei-Ting Tony Tam, Hui-Quan Han, Keith Soo-Nyung Kwak, Xiaolan Zhou, John Lu",2007-03-06,2011-12-19,2013-08-06,2013-08-06,https://patents.google.com/patent/US8501678B2/en,https://patentimages.storage.googleapis.com/56/21/ea/243f0446c5f2e9/US08501678-20130806-D00001.png
WO-2018136762-A1,Methods of treating multiple sclerosis using autologous t cells ,"Atara Biotherapeutics, Inc., The Council Of The Queensland Institute Of Medical Research","Rajiv Khanna, Corey Smith, Blake Tolu AFTAB",2017-01-20,2018-01-19,2018-07-26,,https://patents.google.com/patent/WO2018136762A1/en,
WO-2019083866-A1,Methods of managing tumor flare in adoptive immunotherapy ,"Atara Biotherapeutics, Inc.",Robert Baiocchi,2017-10-23,2018-10-22,2019-05-02,,https://patents.google.com/patent/WO2019083866A1/en,
CA-3035906-A1,Immunotherapy for polyomaviruses ,"Atara Biotherapeutics, Inc., The Council Of The Queensland Institute Of Medical Research, Rajiv Khanna, George Robin Ambalathingal THOMAS, Blake Tolu Aftab","Rajiv Khanna, George Robin Ambalathingal THOMAS, Blake Tolu Aftab",2016-09-09,2017-09-08,2018-03-15,,https://patents.google.com/patent/CA3035906A1/en,
