search URL:,https://patents.google.com/?assignee=CATALENT+INC
US-2670121-A,Flexible follower for metal ampoules ,Scherer Corp R P,"Scherer Robert Pauli, Scherer John Otto, Leon V Whipple",1951-01-31,1951-01-31,1954-02-23,1954-02-23,https://patents.google.com/patent/US2670121A/en,https://patentimages.storage.googleapis.com/48/d3/45/fad35c7e2c7834/US2670121-drawings-page-1.png
US-5624681-A,Tamper evident pharmaceutical dosage form ,R. P. Scherer Corporation,"Keith Tanner, Kelly Orange",1995-04-26,1995-04-26,1997-04-29,1997-04-29,https://patents.google.com/patent/US5624681A/en,
US-3520971-A,Bath capsule ,Scherer Corp R P,Stanley Benford,1966-12-05,1966-12-05,1970-07-21,1970-07-21,https://patents.google.com/patent/US3520971A/en,
FR-2081436-B1,Patent FR2081436B1 ,Scherer Corp R P,,1970-01-15,1971-01-14,1974-08-30,1974-08-30,https://patents.google.com/patent/FR2081436B1/en,
EP-0102832-A2,Hard shell gelatin capsule dipping apparatus and method ,R.P. Scherer Corporation,"Leonard Mackie, Bela N. Lorincz",1982-09-02,1983-09-01,1984-03-14,,https://patents.google.com/patent/EP0102832A2/en,https://patentimages.storage.googleapis.com/80/11/e0/92587c12902b60/imgf0001.png
US-2006249422-A1,Child-resistant blister package with tear tab ,Bates Ronald R Jr,Ronald Bates,2005-05-05,2005-05-05,2006-11-09,,https://patents.google.com/patent/US20060249422A1/en,https://patentimages.storage.googleapis.com/61/e3/71/88fb146540eaa2/US20060249422A1-20061109-D00000.png
US-2008083691-A1,Molded container with raised nipple and method for use ,"Poynter Richard Q, Decoste Peter J","Richard Q. Poynter, Peter J. DeCoste",2006-10-04,2006-10-04,2008-04-10,,https://patents.google.com/patent/US20080083691A1/en,https://patentimages.storage.googleapis.com/US20080083691A1/US20080083691A1-20080410-D00000.png
EP-0837675-A2,Methods and compositions for preparing soft gelatin capsules having shells resistant to permeation by fill materials ,R.P. Scherer Corporation,"Peter Beke, Gilbert T. Rodrigues, Norman S. Stroud, Mani R. Sundararajan, David J. Walker, Elizabeth Youngblood",1995-06-07,1996-06-06,1998-04-29,,https://patents.google.com/patent/EP0837675A2/en,
