search URL:,https://patents.google.com/?assignee=CATALENT+INC
id,title,assignee,inventor/author,priority date,filing/creation date,publication date,grant date,result link,representative figure link
EP-0293406-B1,Solvent system for an ionizable pharmaceutical agent ,R.P. Scherer Corporation,"Man Sum Yu, Foo Song Hom, Sibaprasanna Chakraburti, Chong-Heng Huang, Mahendra Patel",1986-10-17,1987-10-15,1991-09-04,1991-09-04,https://patents.google.com/patent/EP0293406B1/en,
CA-2166891-C,Method for making freeze dried drug dosage forms ,"Sang K. Wong, Patrick Kearney, R.P. Scherer Corporation","Sang K. Wong, Patrick Kearney",1993-07-09,1994-07-08,2001-07-03,2001-07-03,https://patents.google.com/patent/CA2166891C/en,
US-3202151-A,Multidose jet injector ,Scherer Corp R P,Alfred W Kath,1963-04-08,1963-04-08,1965-08-24,1965-08-24,https://patents.google.com/patent/US3202151A/en,https://patentimages.storage.googleapis.com/6a/1c/85/5be1ce1d2d519f/US3202151-drawings-page-1.png
US-3330276-A,Hypodermic jet injector ,Scherer Corp R P,John R Gordon,1963-10-07,1963-10-07,1967-07-11,1967-07-11,https://patents.google.com/patent/US3330276A/en,https://patentimages.storage.googleapis.com/0d/d1/43/86cd8557ca23bb/US3330276-drawings-page-1.png
US-3540444-A,Plastic ampoule for use with hypodermic injector ,Scherer Corp R P,Stephen T Moreland,1968-01-15,1968-01-15,1970-11-17,1970-11-17,https://patents.google.com/patent/US3540444A/en,https://patentimages.storage.googleapis.com/34/2f/33/fc387209f540ae/US3540444-drawings-page-2.png
US-6212791-B1,Method of applying indicia to a fast-dissolving dosage form ,R.P. Scherer Corporation,"Andrew R. Thompson, Richard J. Yarwood, Patrick Kearney",1993-10-01,2000-03-31,2001-04-10,2001-04-10,https://patents.google.com/patent/US6212791B1/en,https://patentimages.storage.googleapis.com/de/86/7e/15c153c9f072f8/US06212791-20010410-D00000.png
US-6340473-B1,Film forming compositions comprising modified starches and iota-carrageenan and methods for manufacturing soft capsules using same ,"R.P. Scherer Technologies, Inc.","Keith Edward Tanner, Peter Robert Draper, John J. Getz, Stephen W. Burnett, Elizabeth Youngblood",1999-07-07,2000-06-30,2002-01-22,2002-01-22,https://patents.google.com/patent/US6340473B1/en,
US-6096338-A,Delivery systems for hydrophobic drugs ,R. P. Scherer Corporation,"Jonathan E. Lacy, Jonathan K. Embleton, Elizabeth A. Perry",1994-03-16,1997-06-27,2000-08-01,2000-08-01,https://patents.google.com/patent/US6096338A/en,https://patentimages.storage.googleapis.com/91/93/5f/ab01decfa34350/US6096338-drawings-page-2.png
US-5188825-A,Freeze-dried dosage forms and methods for preparing the same ,"Iles Martin C, Atherton Angela D, Copping Neil M","Martin C. Iles, Angela D. Atherton, Neil M. Copping",1989-12-28,1989-12-28,1993-02-23,1993-02-23,https://patents.google.com/patent/US5188825A/en,
US-6316027-B1,Fast-dissolving dosage forms for dopamine agonists ,"R. P. Scherer Technologies, Inc.","Edward Stewart Johnson, Anthony Clarke, Richard D. Green",1995-08-18,2000-09-21,2001-11-13,2001-11-13,https://patents.google.com/patent/US6316027B1/en,
US-5756036-A,Method for the manufacture of pharmaceutical cellulose capsules ,"Gs Technologies, Inc.","Ralph R. Grosswald, Jeffory B. Anderson, Clair S. Andrew",1991-05-31,1995-06-05,1998-05-26,1998-05-26,https://patents.google.com/patent/US5756036A/en,https://patentimages.storage.googleapis.com/63/30/13/c8df4746cc3200/US5756036-drawings-page-2.png
EP-0225189-B1,Targeted enteral delivery system ,R.P. Scherer Corporation,"John Desmond Davies, Elka Touitou, Arnold Rubinstein",1985-11-29,1986-11-28,1992-10-07,1992-10-07,https://patents.google.com/patent/EP0225189B1/en,https://patentimages.storage.googleapis.com/cc/67/28/c81f4cb61d9865/imgf0001.png
US-6007264-A,Integral package applicator ,"Felix Investments, Llc",Kurtis James Koptis,1998-12-02,1998-12-02,1999-12-28,1999-12-28,https://patents.google.com/patent/US6007264A/en,https://patentimages.storage.googleapis.com/91/f8/e9/a4a81d62e6da4b/US6007264-drawings-page-2.png
US-5046618-A,Child-resistant blister pack ,R. P. Scherer Corporation,Anthony J. G. Wood,1990-11-19,1990-11-19,1991-09-10,1991-09-10,https://patents.google.com/patent/US5046618A/en,https://patentimages.storage.googleapis.com/16/e2/71/e1124c53318f56/US5046618-drawings-page-2.png
US-4642903-A,Freeze-dried foam dosage form ,R. P. Scherer Corporation,J. Desmond Davies,1985-03-26,1985-03-26,1987-02-17,1987-02-17,https://patents.google.com/patent/US4642903A/en,
US-2928390-A,Multi-dose hypodermic injector ,Scherer Corp R P,"Venditty Anthony, Lee R Hammer",1957-07-15,1957-07-15,1960-03-15,1960-03-15,https://patents.google.com/patent/US2928390A/en,https://patentimages.storage.googleapis.com/b8/91/05/0e44751e4f92f4/US2928390-drawings-page-1.png
US-6425888-B1,Ocular treatment device ,R. P. Scherer Corporation,"Jonathan K. Embleton, Stephen P. Jones, Richard J. Malcolmson, Luigi G. Martini, Peter J. Houzego, Sarah A. Rocca, Howard N. Stevens",1994-08-30,1995-08-30,2002-07-30,2002-07-30,https://patents.google.com/patent/US6425888B1/en,https://patentimages.storage.googleapis.com/d9/3a/46/4ddf9e8f403137/US6425888-drawings-page-2.png
US-3330277-A,Multidose hypodermic injector ,Scherer Corp R P,Walter P Gabriels,1964-08-17,1964-08-17,1967-07-11,1967-07-11,https://patents.google.com/patent/US3330277A/en,https://patentimages.storage.googleapis.com/56/67/88/67f6dfb45463cd/US3330277-drawings-page-1.png
US-5358118-A,Stepped edge blister pack ,R.P. Scherer Corporation,"Andrew R. Thompson, Ray W. Marshall",1992-09-30,1994-02-18,1994-10-25,1994-10-25,https://patents.google.com/patent/US5358118A/en,https://patentimages.storage.googleapis.com/a6/e1/14/5a6fc000d2e5ea/US5358118-drawings-page-2.png
US-5976577-A,Process for preparing fast dispersing solid oral dosage form ,Rp Scherer Corporation,"Richard Green, Patrick Kearney",1997-07-11,1997-07-11,1999-11-02,1999-11-02,https://patents.google.com/patent/US5976577A/en,
US-7090866-B2,Opioid agonist in a fast dispersing dosage form ,"R.P. Scherer Technologies, Inc.","Edward Stewart Johnson, Jon Lacy",1999-03-03,2003-08-25,2006-08-15,2006-08-15,https://patents.google.com/patent/US7090866B2/en,
US-3867521-A,Method for absorption of drugs ,Scherer Corp R P,"John J Miskel, Foo Song Hom",1970-08-26,1972-02-07,1975-02-18,1975-02-18,https://patents.google.com/patent/US3867521A/en,
EP-0646367-B1,A multilayer laminated blister film ,R.P. Scherer Limited,"Patrick 59 Belsay Toothill Kearney, Andrew Roy Thompson, Richard John Yarwood",1992-12-01,1993-11-30,1997-05-28,1997-05-28,https://patents.google.com/patent/EP0646367B1/en,https://patentimages.storage.googleapis.com/25/c1/94/ad9c161c0af9cf/imgf0001.png
US-7607834-B2,Peelable pouch containing a single or multiple dosage forms and process of making same ,"R.P. Scherer Technologies, Inc.","Paul Hamilton Alvater, Thomas John Fillis",2004-08-02,2004-08-02,2009-10-27,2009-10-27,https://patents.google.com/patent/US7607834B2/en,https://patentimages.storage.googleapis.com/US7607834B2/US07607834-20091027-D00000.png
US-5587149-A,Topical application emulsions ,R.P. Scherer Corporation,"Louis Punto, Chim Potini, Pilar Duque, Eva Gould",1995-02-06,1995-02-06,1996-12-24,1996-12-24,https://patents.google.com/patent/US5587149A/en,https://patentimages.storage.googleapis.com/29/96/6e/9bc2c81a428fe9/US5587149-drawings-page-2.png
CA-2369715-C,Fast-dispersing dosage forms containing fish gelatin ,"R.P. Scherer Corporation, Owen Murray, Michael Hall, Richard Green, Patrick Kearney, Cardinal Health 409, Inc.","Owen Murray, Michael Hall, Richard Green, Patrick Kearney",1999-04-08,2000-04-07,2006-03-21,2006-03-21,https://patents.google.com/patent/CA2369715C/en,
US-5150793-A,Device for inhibiting removal of an article from a blister-type container ,"Pci/Delvco, Inc.",Michael A. Tannenbaum,1991-10-16,1991-10-16,1992-09-29,1992-09-29,https://patents.google.com/patent/US5150793A/en,https://patentimages.storage.googleapis.com/8b/67/ce/f78a8f9581da9c/US5150793-drawings-page-2.png
EP-0121321-B1,Pharmaceutical compositions ,R.P. Scherer Corporation,Werner Brox,1983-03-02,1984-02-27,1991-07-10,1991-07-10,https://patents.google.com/patent/EP0121321B1/en,
CA-1211712-A,Soft gelatine capsule ,"Werner Brox, Scherer (R.P.) Corporation",Werner Brox,1983-03-02,1984-03-01,1986-09-23,1986-09-23,https://patents.google.com/patent/CA1211712A/en,
US-5827541-A,Process for preparing solid pharmaceutical dosage forms of hydrophobic substances ,R. P. Scherer Corporation,"Richard John Yarwood, Patrick Kearney, Andrew Roy Thompson",1994-10-28,1995-10-20,1998-10-27,1998-10-27,https://patents.google.com/patent/US5827541A/en,
US-4428927-A,Masticatory soft elastic gelatin capsules and method for the manufacture thereof ,R. P. Scherer Corporation,"William R. Ebert, Foo S. Hom, Warren W. Kindt",1981-05-11,1982-05-07,1984-01-31,1984-01-31,https://patents.google.com/patent/US4428927A/en,
US-5244091-A,Device for inhibiting removal of an article from a blister container ,"Pci/Delvco, Inc.",Michael A. Tannenbaum,1991-10-16,1992-01-17,1993-09-14,1993-09-14,https://patents.google.com/patent/US5244091A/en,https://patentimages.storage.googleapis.com/9a/5a/79/3afd94c6c795ef/US5244091-drawings-page-2.png
US-5912011-A,Solvent system to be enclosed in capsules ,R. P. Scherer Corporation,"Hirokazu Makino, Ichiro Hakamada, Osamu Yamada",1991-12-19,1995-03-08,1999-06-15,1999-06-15,https://patents.google.com/patent/US5912011A/en,
US-5738875-A,Process for preparing solid pharmaceutical dosage forms ,R.P. Scherer Corporation,"Richard J. Yarwood, Patrick Kearney, Andrew R. Thompson",1994-10-28,1994-10-28,1998-04-14,1998-04-14,https://patents.google.com/patent/US5738875A/en,
US-5740931-A,Torque-resistant closure with a spike connector insert for a hermetically sealed container ,"Automatic Liquid Packaging, Inc.",Gerhard H. Weiler,1994-06-02,1996-07-30,1998-04-21,1998-04-21,https://patents.google.com/patent/US5740931A/en,https://patentimages.storage.googleapis.com/3f/f2/43/53faaee637dca4/US5740931-drawings-page-2.png
US-7458741-B2,Multiple compartment storage and dispensing apparatus ,"R.P. Scherer Technologies, Inc.","Bruce D. Detwiler, Dennis H. Chadwick",2003-05-08,2004-04-15,2008-12-02,2008-12-02,https://patents.google.com/patent/US7458741B2/en,https://patentimages.storage.googleapis.com/US7458741B2/US07458741-20081202-D00000.png
US-5376688-A,Enhanced solubility pharmaceutical solutions ,R. P. Scherer Corporation,"Frank S. S. Morton, Rickey S. Shelley, Mahendra S. Patel",1992-12-18,1992-12-18,1994-12-27,1994-12-27,https://patents.google.com/patent/US5376688A/en,
US-5711453-A,Cap with draining spike for use with hermetically sealed dispensing container ,"Automatic Liquid Packaging, Inc.",Gerhard H. Weiler,1995-06-07,1995-06-07,1998-01-27,1998-01-27,https://patents.google.com/patent/US5711453A/en,https://patentimages.storage.googleapis.com/c7/f5/f7/31dee917c05d63/US5711453-drawings-page-2.png
US-6379707-B2,Method of making granular pharmaceutical vehicle ,Fmc Corporation,"Ronald S. Vladyka, Jr., David F. Erkoboni, Pamela R. Stergios",1999-03-24,2001-06-21,2002-04-30,2002-04-30,https://patents.google.com/patent/US6379707B2/en,
US-5535885-A,Fragrance sample container ,R.P. Scherer Corporation,"Paula Daniel, Gregory A. Schurig, Suzanne O'Neill",1992-12-18,1994-03-15,1996-07-16,1996-07-16,https://patents.google.com/patent/US5535885A/en,https://patentimages.storage.googleapis.com/95/87/b5/c9fd31cc6d071c/US5535885-drawings-page-2.png
US-4040536-A,Locking hard gelatin capsule ,R. P. Scherer Corporation,Erwin Schwarz,1975-05-05,1975-05-05,1977-08-09,1977-08-09,https://patents.google.com/patent/US4040536A/en,https://patentimages.storage.googleapis.com/98/f6/ee/bb8a5d7399c1c9/US4040536-drawings-page-2.png
US-2648463-A,Plastic container with rupturable sealed end ,Scherer Corp R P,Scherer Robert Pauli,1948-05-08,1948-05-08,1953-08-11,1953-08-11,https://patents.google.com/patent/US2648463A/en,https://patentimages.storage.googleapis.com/c1/f1/01/1329023c5f34e6/US2648463-drawings-page-1.png
US-4656092-A,Target shooting capsules ,R. P. Scherer Corporation,"Frederic E. Haman, Keith E. Schmoke",1985-10-15,1985-10-15,1987-04-07,1987-04-07,https://patents.google.com/patent/US4656092A/en,
US-2754818-A,Hypo jet injector ,Scherer Corp R P,Scherer Robert Pauli,1950-06-24,1950-06-24,1956-07-17,1956-07-17,https://patents.google.com/patent/US2754818A/en,https://patentimages.storage.googleapis.com/62/98/e6/c339b1aa6638c0/US2754818-drawings-page-1.png
US-3851051-A,Soft gelatin capsule containing high water content fill ,Scherer R Corp,"E Connor, J Miskel, W Kindt",1970-07-17,1970-07-17,1974-11-26,1974-11-26,https://patents.google.com/patent/US3851051A/en,
US-5817323-A,Soft gelatin capsule shell compositions ,R.P. Scherer Corporation,"Keith Graeme Hutchinson, Kelvin Royce Garnett, Gerhard Fischer, Nicola Sandra Page",1993-06-28,1994-06-23,1998-10-06,1998-10-06,https://patents.google.com/patent/US5817323A/en,
US-6036016-A,Blister package with easy tear blister ,"Pinnacle Intellectual Property Services, Inc.",William Arnold,1998-04-20,1998-04-20,2000-03-14,2000-03-14,https://patents.google.com/patent/US6036016A/en,https://patentimages.storage.googleapis.com/1e/9a/58/8a71e54ac41ca2/US6036016-drawings-page-7.png
US-6308747-B1,Needleless method and apparatus for transferring liquid from a container to an injecting device without ambient air contamination ,Barry Farris,Barry Farris,1998-10-01,1998-10-01,2001-10-30,2001-10-30,https://patents.google.com/patent/US6308747B1/en,https://patentimages.storage.googleapis.com/bf/09/5d/19fa36bd736e83/US6308747-drawings-page-2.png
US-5725886-A,Microcrystalline cellulose spheronization composition ,Fmc Corporation,"David F. Erkoboni, Scott A. Fiore, Thomas A. Wheatley",1991-12-30,1994-09-26,1998-03-10,1998-03-10,https://patents.google.com/patent/US5725886A/en,
US-7325703-B2,Multi-cavity blister package for storing and dispensing flowable substances ,"R.P. Scherer Technologies, Inc.","Victor Gherdan, Dennis Chadwick, David Barndt",2005-06-16,2005-06-16,2008-02-05,2008-02-05,https://patents.google.com/patent/US7325703B2/en,https://patentimages.storage.googleapis.com/US7325703B2/US07325703-20080205-D00000.png
US-7464818-B2,Child resistant and senior friendly medicament storage and distribution package ,"R.P. Scherer Technologies, Inc.","Victor Gherdan, David Barndt, Tim Craig",2005-10-14,2005-10-14,2008-12-16,2008-12-16,https://patents.google.com/patent/US7464818B2/en,https://patentimages.storage.googleapis.com/US7464818B2/US07464818-20081216-D00000.png
US-2762369-A,Hypodermic injector with adjustable impact plunger ,Scherer Corp R P,Venditty Anthony,1954-09-07,1954-09-07,1956-09-11,1956-09-11,https://patents.google.com/patent/US2762369A/en,https://patentimages.storage.googleapis.com/42/7f/4a/bf5b3e718f9487/US2762369-drawings-page-1.png
US-5891470-A,Softgel formulation containing retinol ,"Advanced Polymer Systems, Inc., R.P. Scherer Corporation","Marie A. Rinaldi, Subhash J. Saxena, Paul C. Tutschek",1998-04-17,1998-04-17,1999-04-06,1999-04-06,https://patents.google.com/patent/US5891470A/en,
US-4800083-A,Sustained release method and product ,R. P. Scherer Corporation,"Foo S. Hom, William R. Ebert",1986-10-20,1986-10-20,1989-01-24,1989-01-24,https://patents.google.com/patent/US4800083A/en,https://patentimages.storage.googleapis.com/59/c6/91/e19b78a9a65eba/US4800083-drawings-page-2.png
US-5858409-A,Hydrolyzed cellulose granulations for pharmaceuticals ,Fmc Corporation,"Marc S. Karetny, David F. Erkoboni, Ronald S. Vladyka, Jr., Howard J. Stamato",1996-04-17,1996-04-17,1999-01-12,1999-01-12,https://patents.google.com/patent/US5858409A/en,
US-6509040-B1,Fast dispersing dosage forms essentially free of mammalian gelatin ,R.P. Scherer Corporation,"Owen James Murray, Richard Green, Patrick Kearney, Leon Paul Grother",2001-06-22,2001-06-22,2003-01-21,2003-01-21,https://patents.google.com/patent/US6509040B1/en,
US-4532126-A,Masticatory soft elastic gelatin capsules and method for the manufacture thereof ,R. P. Scherer Corporation,"William R. Ebert, Foo S. Hom, Warren W. Kindt",1982-05-07,1983-11-08,1985-07-30,1985-07-30,https://patents.google.com/patent/US4532126A/en,
EP-0676945-B2,Encapsulation apparatus and process ,R.P. Scherer Corporation,"Arthur James 9 Hodson Road BURNETT, Kelvin Royce 6 Pleydells Garnett, Norman Stafford Stroud, David John Apartment 73 WALKER, Anthony John G. 63 Woodham Wayne WOOD",1992-12-16,1993-12-16,2004-03-03,2004-03-03,https://patents.google.com/patent/EP0676945B2/en,https://patentimages.storage.googleapis.com/69/04/b5/9ca09505d28edb/00230001.png
US-5395365-A,Container with pierceable and/or collapsible features ,"Automatic Liquid Packaging, Inc.","Gerhard H. Weiler, Henry Komendowski",1993-03-22,1993-03-22,1995-03-07,1995-03-07,https://patents.google.com/patent/US5395365A/en,https://patentimages.storage.googleapis.com/f6/6f/2b/99620fc5a6d758/US5395365-drawings-page-2.png
US-9541547-B2,Fusion antibodies ,"Catalent Pharma Solutions, Inc.","Gregory T. Bleck, Dona York, Ian Collins",2003-07-28,2010-03-09,2017-01-10,2017-01-10,https://patents.google.com/patent/US9541547B2/en,https://patentimages.storage.googleapis.com/b6/0b/38/757f720340c67b/US09541547-20170110-D00001.png
US-6588180-B2,Constricted neck blister pack and apparatus and method for making the same ,"R. P. Scherer Technologies, Inc.","Kenneth Heath, Kevin William Greaves",2001-02-02,2001-02-02,2003-07-08,2003-07-08,https://patents.google.com/patent/US6588180B2/en,https://patentimages.storage.googleapis.com/77/54/6d/09f0b49701efe9/US06588180-20030708-D00000.png
US-6852510-B2,Host cells containing multiple integrating vectors ,Gala Design Inc,"Robert D. Bremel, Linda U. Miller, Gregory T. Bleck",2000-07-03,2001-06-29,2005-02-08,2005-02-08,https://patents.google.com/patent/US6852510B2/en,https://patentimages.storage.googleapis.com/fb/54/e0/415d8ea6af5085/US06852510-20050208-D00001.png
US-4325761-A,"Two-piece hardshell, soluble and digestible liquid containing gelatin capsule ",R. P. Scherer Corporation,Joseph A. Pace,1979-10-31,1980-08-14,1982-04-20,1982-04-20,https://patents.google.com/patent/US4325761A/en,https://patentimages.storage.googleapis.com/a8/06/13/1d9ff4f268d047/US4325761-drawings-page-2.png
US-8231896-B2,Non-gelatin soft capsule system ,"R.P. Scherer Technologies, Llc","Keith E. Tanner, Rickey S. Shelley, Norman S. Stroud, Elizabeth Youngblood",2004-11-08,2004-11-08,2012-07-31,2012-07-31,https://patents.google.com/patent/US8231896B2/en,
US-2460039-A,Hypodermic syringe ,Scherer Corp R P,"Robert P Scherer, Scherer John Otto",1944-04-14,1944-04-14,1949-01-25,1949-01-25,https://patents.google.com/patent/US2460039A/en,https://patentimages.storage.googleapis.com/10/3b/e3/75d689a58b8ade/US2460039-drawings-page-1.png
US-5871798-A,Method of making water based beverages ,R. P. Scherer,"Keith Graeme Hutchison, Kelvin Royce Garnett",1993-02-11,1997-09-11,1999-02-16,1999-02-16,https://patents.google.com/patent/US5871798A/en,
US-5221058-A,Registration control for continuously moving laminated package apparatus ,"Packaging Coordinators, Inc.",Tom Fillis,1991-08-01,1991-08-01,1993-06-22,1993-06-22,https://patents.google.com/patent/US5221058A/en,https://patentimages.storage.googleapis.com/cf/fa/f2/c8bdc9ba99489b/US5221058-drawings-page-2.png
US-6830153-B2,Child-resistant blister pack ,"R. P. Scherer Technologies, Inc.","Gary Stuart French, Malcolm Ronald Kidd",2002-05-08,2002-05-08,2004-12-14,2004-12-14,https://patents.google.com/patent/US6830153B2/en,https://patentimages.storage.googleapis.com/f6/8e/d7/25c0ec68343584/US06830153-20041214-D00000.png
US-7360652-B2,Child resistant product dispenser ,"R.P. Scherer Technologies, Inc.",William Arnold,2004-06-11,2004-06-11,2008-04-22,2008-04-22,https://patents.google.com/patent/US7360652B2/en,https://patentimages.storage.googleapis.com/US7360652B2/US07360652-20080422-D00000.png
US-5904937-A,Taste masked pharmaceutical compositions ,Fmc Corporation,"Michael Augello, Ronald S. Vladyka, Jr., Sheila M. Dell",1997-10-03,1997-10-03,1999-05-18,1999-05-18,https://patents.google.com/patent/US5904937A/en,
EP-0098041-B1,"Sesquiterpene lactones, extracts containing them, their preparation and pharmaceutical use ",R.P. Scherer Corporation,"Edward Stewart Johnson, Peter John Hylands, Deborah Margaret Hylands née Jessup",1982-05-19,1983-05-17,1989-08-02,1989-08-02,https://patents.google.com/patent/EP0098041B1/en,https://patentimages.storage.googleapis.com/e2/11/6c/740d1079efc4bd/imgf0001.png
US-5380534-A,Soft gelatin medicament capsules with gripping construction ,R.P. Scherer Corporation,"Gregory A. Schurig, Frank S. S. Morton, Norman S. Stroud",1992-08-18,1993-12-09,1995-01-10,1995-01-10,https://patents.google.com/patent/US5380534A/en,https://patentimages.storage.googleapis.com/0c/fb/00/6da79282450694/US5380534-drawings-page-2.png
US-2704542-A,Jet therapy method ,Scherer Corp R P,Scherer Robert Pauli,1949-02-21,1949-02-21,1955-03-22,1955-03-22,https://patents.google.com/patent/US2704542A/en,https://patentimages.storage.googleapis.com/49/6a/65/0601596fb311ad/US2704542-drawings-page-1.png
US-4727109-A,Pharmaceutical preparation with an active substance of low solubility in water and gastric juices ,R. P. Scherer Corporation,"Peter C. Schmidt, Bernd Stockebrand, Gerhard Fischer",1985-01-04,1985-12-30,1988-02-23,1988-02-23,https://patents.google.com/patent/US4727109A/en,https://patentimages.storage.googleapis.com/47/3b/1e/983d9b2cf8e1d6/US4727109-drawings-page-2.png
US-6068148-A,Hermetically sealed container including a nozzle with a sealing bead ,"Automatic Liquid Packaging, Inc.",Gerhard H. Weiler,1998-05-26,1998-05-26,2000-05-30,2000-05-30,https://patents.google.com/patent/US6068148A/en,https://patentimages.storage.googleapis.com/7a/aa/83/ef8397ab022a68/US6068148-drawings-page-2.png
US-5614217-A,Capsule shell formulation to produce brittle capsules ,R.P. Scherer Corporation,"Timothy B. Chiprich, Michael T. Hoylman, Norman S. Stroud",1995-06-07,1995-06-07,1997-03-25,1997-03-25,https://patents.google.com/patent/US5614217A/en,https://patentimages.storage.googleapis.com/a0/8c/cd/25cd2de6e7aa28/US5614217-drawings-page-2.png
EP-0713390-B1,Gelatin capsules containing a highly concentrated acetaminophen solution ,R.P. Scherer Corporation,"Deborah Linking, Rickey S. Shelley, Youching Wei",1993-08-05,1994-08-04,1999-06-09,1999-06-09,https://patents.google.com/patent/EP0713390B1/en,
CA-2360647-C,Fast dispersing dosage forms free of gelatin ,"R.P. Scherer Corporation, Leon Paul Grother, Owen James Murray, Richard Green, Patrick Kearney, Cardinal Health 409, Inc.","Leon Paul Grother, Owen James Murray, Richard Green, Patrick Kearney",1999-01-27,2000-01-27,2005-08-02,2005-08-02,https://patents.google.com/patent/CA2360647C/en,
US-4951659-A,Nebulizer with cooperating disengageable on-line heater ,"Automatic Liquid Packaging, Inc.","Gerhard H. Weiler, Henry Komendowski",1988-11-04,1988-11-04,1990-08-28,1990-08-28,https://patents.google.com/patent/US4951659A/en,https://patentimages.storage.googleapis.com/af/7d/73/ea347ba735b7e1/US4951659-drawings-page-2.png
US-2703047-A,Machine for branding capsules ,Scherer Corp R P,"Scherer Robert Pauli, Stephen T Moreland",1952-07-12,1952-07-12,1955-03-01,1955-03-01,https://patents.google.com/patent/US2703047A/en,https://patentimages.storage.googleapis.com/7a/b2/0d/034ca897af09dc/US2703047-drawings-page-1.png
EP-1362685-B2,Hermetically sealed container with frangible web and locking lugs and method and apparatus for making same ,"Cardinal Health 400, Inc.","Gerhard H. Weiler, Arjun Ramrakhyani",1996-04-23,1997-04-23,2011-07-27,2011-07-27,https://patents.google.com/patent/EP1362685B2/en,https://patentimages.storage.googleapis.com/4c/3b/2d/c7da71f0df4e03/imgf0001.png
CA-1296628-C,"Ethanol fill formulation for softgels containing vitamins, dietary supplements and the like ","Werner Brox, R.P. Scherer Corporation",Werner Brox,1986-08-29,1987-08-28,1992-03-03,1992-03-03,https://patents.google.com/patent/CA1296628C/en,
US-5595314-A,Torque-resistant closure for a hermetically sealed container ,"Automatic Liquid Packaging, Inc.",Gerhard H. Weiler,1994-06-02,1995-01-25,1997-01-21,1997-01-21,https://patents.google.com/patent/US5595314A/en,https://patentimages.storage.googleapis.com/24/12/5f/4424bdf596a152/US5595314-drawings-page-2.png
US-5462200-A,Threaded cap with controlled orifice liner for piercing a sealed container ,"Automatic Liquid Packaging, Inc.",Gerhard H. Weiler,1994-01-21,1994-01-21,1995-10-31,1995-10-31,https://patents.google.com/patent/US5462200A/en,https://patentimages.storage.googleapis.com/74/52/29/1fa9734b0fd78c/US5462200-drawings-page-2.png
US-5716346-A,Method and apparatus for loading syringes without the need for hypodermic needles ,Farris; Barry,Barry Farris,1993-07-02,1993-07-02,1998-02-10,1998-02-10,https://patents.google.com/patent/US5716346A/en,https://patentimages.storage.googleapis.com/dd/ea/01/ba520a61bf741f/US5716346-drawings-page-2.png
US-5554385-A,High amylose starch substituted gelatin capsules ,R. P. Scherer Corporation,Norman Stroud,1990-11-28,1994-11-22,1996-09-10,1996-09-10,https://patents.google.com/patent/US5554385A/en,
US-5750143-A,Controlled release device ,R.P. Scherer Corporation,"Abdul Rashid, Howard Norman Ernest Stevens, Julie Stephanie Binns, James Leonard Mackie",1992-11-04,1993-11-04,1998-05-12,1998-05-12,https://patents.google.com/patent/US5750143A/en,https://patentimages.storage.googleapis.com/09/52/14/bbfba524317319/US5750143-drawings-page-2.png
US-2003232076-A1,Chewable soft capsule ,"Hirokazu Makino, Yoko Sumino, Hideo Suzuki, Tomohisa Mastushita","Hirokazu Makino, Yoko Sumino, Hideo Suzuki, Tomohisa Mastushita",2002-06-07,2003-06-06,2003-12-18,,https://patents.google.com/patent/US20030232076A1/en,https://patentimages.storage.googleapis.com/92/78/f8/19cfdbedd1d8a4/US20030232076A1-20031218-D00001.png
