search URL:,https://patents.google.com/?assignee=CATALENT+INC
US-2004023948-A1,Fast-dispersing dosage form containing 5-HT1 agonists ,"Green Richard David, Jonathan Lacy, Nicholas Mallard, JOHNSON Edward","Richard Green, Jonathan Lacy, Nicholas Mallard, Edward Johnson",1997-03-24,2003-02-26,2004-02-05,,https://patents.google.com/patent/US20040023948A1/en,https://patentimages.storage.googleapis.com/98/ee/0b/f3f3cad138ecf5/US20040023948A1-20040205-D00001.png
US-2936493-A,Method of making plastic capsules ,Scherer Corp R P,Robert P Scherer,1955-06-16,1955-06-16,1960-05-17,1960-05-17,https://patents.google.com/patent/US2936493A/en,https://patentimages.storage.googleapis.com/52/24/33/90507594f05ea9/US2936493-drawings-page-1.png
US-4464363-A,Ajuvants for rectal delivery of drug substances ,"Merck & Co., Inc.","Takeru Higuchi, Toshiaki Nishihata, Howard J. Rytting",1979-12-20,1981-06-25,1984-08-07,1984-08-07,https://patents.google.com/patent/US4464363A/en,https://patentimages.storage.googleapis.com/da/f9/b3/fcbca68d129444/US4464363-drawings-page-2.png
US-6099865-A,Croscarmellose taste masking ,Fmc Corporation,"Michael Augello, Sheila M. Dell, George E. Reier, Howard J. Stamato, Lynn M. DiMemmo",1998-07-08,1999-06-11,2000-08-08,2000-08-08,https://patents.google.com/patent/US6099865A/en,
US-3130723-A,Multidose jet injector ,Scherer Corp R P,"Venditty Anthony, Alfred W Kath",1960-08-15,1960-08-15,1964-04-28,1964-04-28,https://patents.google.com/patent/US3130723A/en,https://patentimages.storage.googleapis.com/08/4e/25/d271f3b6bec2c0/US3130723-drawings-page-1.png
US-2870062-A,Gelatin composition for capsules ,Scherer Corp R P,"John P Stanley, Clayton W Bradley",1956-04-27,1956-04-27,1959-01-20,1959-01-20,https://patents.google.com/patent/US2870062A/en,
US-2005045667-A1,Disposable single-use container with indicia bearing portion ,Poynter Richard Q.,Richard Poynter,2003-09-03,2003-09-03,2005-03-03,,https://patents.google.com/patent/US20050045667A1/en,https://patentimages.storage.googleapis.com/59/f1/33/e9b6ce4514833e/US20050045667A1-20050303-D00000.png
US-4989649-A,Fill machine sterilization process ,"Automatic Liquid Packaging, Inc.","Gerhard H. Weiler, Arjun Ramrakhyani, Paul A. Anderson, Frank N. Leo",1989-09-14,1989-09-14,1991-02-05,1991-02-05,https://patents.google.com/patent/US4989649A/en,https://patentimages.storage.googleapis.com/e8/ad/66/3566412aaf9fba/US4989649-drawings-page-2.png
US-2816543-A,Hypodermic injector ,Scherer Corp R P,"Venditty Anthony, John O Scherer",1954-07-12,1954-07-12,1957-12-17,1957-12-17,https://patents.google.com/patent/US2816543A/en,https://patentimages.storage.googleapis.com/f1/e1/bc/a7b46e7092b19e/US2816543-drawings-page-1.png
US-2003127760-A1,Apparatus and methods for forming patterned soft gelatin capsules ,R. P. Scherer Corporation,"Gregory Schurig, Bud Bezaire, Michael Ratko, Lawrence Baker, Robert Mikalian",1992-08-10,2003-02-24,2003-07-10,,https://patents.google.com/patent/US20030127760A1/en,https://patentimages.storage.googleapis.com/11/86/82/9c79cec7beb21a/US20030127760A1-20030710-D00000.png
AU-763971-B2,Oral pharmaceutical compositions containing long-chain triglycerides and lipophilic surfactants ,R.P. Scherer Corporation,"Susan Chandler, Henrik De Nijs, Josephine Joan Christine Ferdinando, Elizabeth A. Perry",1999-04-01,2000-03-29,2003-08-07,2003-08-07,https://patents.google.com/patent/AU763971B2/en,
US-2681168-A,Envelope containing a fragile capsule ,Scherer Corp R P,Mcmillion Shelby Clyde,1949-07-09,1949-07-09,1954-06-15,1954-06-15,https://patents.google.com/patent/US2681168A/en,https://patentimages.storage.googleapis.com/86/96/65/3bd40d85e3a051/US2681168-drawings-page-1.png
EP-1345647-B1,Container with medicament storing and dispensing insert ,"Weiler Engineering, Inc., Cardinal Health 400, Inc.","Frank N. Leo, Gerhard H. Weiler",2000-12-06,2001-12-04,2009-08-19,2009-08-19,https://patents.google.com/patent/EP1345647B1/en,https://patentimages.storage.googleapis.com/b5/18/2f/1007af8d20ee13/imgf0001.png
US-2762370-A,Hypodermic injector ,Scherer Corp R P,Venditty Anthony,1954-09-07,1954-09-07,1956-09-11,1956-09-11,https://patents.google.com/patent/US2762370A/en,https://patentimages.storage.googleapis.com/ab/b4/79/5fd4936f9805d0/US2762370-drawings-page-1.png
US-5569466-A,Fill compositions for soft elastic gel capsules ,R. P. Scherer Corporation,"Keith Tanner, Rickey S. Shelley",1995-05-17,1995-05-17,1996-10-29,1996-10-29,https://patents.google.com/patent/US5569466A/en,
US-3314429-A,Gelatin capsule with dispenser ,Scherer Corp R P,"Norman J Boehm, Charles C Cochran",1964-09-14,1964-09-14,1967-04-18,1967-04-18,https://patents.google.com/patent/US3314429A/en,https://patentimages.storage.googleapis.com/e9/4c/2c/20b60bb0998e7d/US3314429-drawings-page-1.png
AU-718160-B2,Soft gelatin capsules containing particulate material ,R.P. Scherer Corporation,"John L. Cain, Frank A. Morton, Brian R. Pansari, Gregory A Schurig, Rickey S Shelley, Keith E. Tanner, Younching Wei",1995-06-09,1996-06-06,2000-04-06,2000-04-06,https://patents.google.com/patent/AU718160B2/en,
US-9532585-B2,Ingestible compositions containing an odoriferous oil ,"R.P. Scherer Technologies, Llc","Dennis Rowe, Kelvin Royce Garnett",2001-01-17,2002-01-16,2017-01-03,2017-01-03,https://patents.google.com/patent/US9532585B2/en,
AU-3391495-A,Ocular treatment device ,Pharmacia & Upjohn Ab,"Jonathan Kenneth Embleton, Peter John Houzego, Stephen Philip Jones, Richard Joseph Malcolmson, Luigi Gerard Anthony Martini, Sarah Anne Rocca, Howard Norman Ernest Stevens",1994-08-30,1995-08-30,1996-03-22,,https://patents.google.com/patent/AU3391495A/en,
US-3490451-A,Hypodermic jet injector nozzle ,Scherer Corp R P,Gilbert I Yahner,1967-11-13,1967-11-13,1970-01-20,1970-01-20,https://patents.google.com/patent/US3490451A/en,https://patentimages.storage.googleapis.com/0a/b2/89/e56f90b50771c9/US3490451-drawings-page-1.png
US-2004091525-A1,Pharmaceutical composition formulated for pre-gastric absorption of monoamine oxidase B inhibitor component ,"Brewer Francesca Mary, Johnson Edward Stewart, Anthony Clarke","Francesca Brewer, Edward Johnson, Anthony Clarke",1995-03-02,2003-07-01,2004-05-13,,https://patents.google.com/patent/US20040091525A1/en,https://patentimages.storage.googleapis.com/01/18/38/cd595c3ac131cb/US20040091525A1-20040513-D00001.png
US-6652880-B1,Oral pharmaceutical compositions containing long-chain triglycerides and liphophilic surfactants ,"R.P. Scherer Technologies, Inc.","Elizabeth Anne Aylwin, Susan Banbury, Josephine Joan Christine Ferdinando, Henrik de Nijs",1999-04-01,2000-03-29,2003-11-25,2003-11-25,https://patents.google.com/patent/US6652880B1/en,
US-5434672-A,Pixel error diffusion method ,Hewlett-Packard Company,Michael D. McGuire,1993-06-23,1993-06-23,1995-07-18,1995-07-18,https://patents.google.com/patent/US5434672A/en,https://patentimages.storage.googleapis.com/d8/64/e6/47e3005b48a106/US5434672-drawings-page-2.png
US-5770224-A,Capsule construction ,R. P. Scherer Corporation,"Abdul Rashid, Howard Norman Ernest Stevens, Massoud Bakhshaee, James Robertson Miller Kelso, Mark Hegarty, James Leonard Mackie",1992-11-04,1993-11-04,1998-06-23,1998-06-23,https://patents.google.com/patent/US5770224A/en,https://patentimages.storage.googleapis.com/2e/6b/fa/31b792153a3642/US5770224-drawings-page-2.png
US-7378273-B2,Expression vectors ,"Gala Design, Inc.",Gregory T. Bleck,2000-07-03,2004-09-23,2008-05-27,2008-05-27,https://patents.google.com/patent/US7378273B2/en,https://patentimages.storage.googleapis.com/US7378273B2/US07378273-20080527-D00001.png
CA-1041905-A,Integral solid gel-lattice dosage form of high moisture content ,"R. P. Scherer Corporation, John J. Miskel, Warren W. Kindt, Edward C. Connor","John J. Miskel, Warren W. Kindt, Edward C. Connor",1972-04-03,1973-03-26,1978-11-07,1978-11-07,https://patents.google.com/patent/CA1041905A/en,
US-2552870-A,Sealed tube with finger-engaging opening tabs ,Scherer Corp R P,Scherer John Otto,1948-11-13,1948-11-13,1951-05-15,1951-05-15,https://patents.google.com/patent/US2552870A/en,https://patentimages.storage.googleapis.com/45/b5/2d/c05537db36c0c3/US2552870-drawings-page-1.png
US-3521633-A,Brake device for hypodermic jet injector ,Scherer Corp R P,Gilbert I Yahner,1967-11-13,1967-11-13,1970-07-28,1970-07-28,https://patents.google.com/patent/US3521633A/en,https://patentimages.storage.googleapis.com/24/c8/4e/42c635bd8bfb99/US3521633-drawings-page-1.png
US-5121856-A,Sleeved dispensing vial ,"Automatic Liquid Packaging, Inc.","Gerhard H. Weiler, Henry Komendowski",1990-11-30,1990-11-30,1992-06-16,1992-06-16,https://patents.google.com/patent/US5121856A/en,https://patentimages.storage.googleapis.com/2a/1d/1a/35c6ebcb95c443/US5121856-drawings-page-2.png
US-6156339-A,Process for preparing solid pharmaceutical dosage forms ,R.P. Scherer Corporation,"Leon Grother, Michael Hall, Douglas Bryans, Richard Green, Patrick Kearney",1997-02-12,1999-08-10,2000-12-05,2000-12-05,https://patents.google.com/patent/US6156339A/en,
AU-642136-B2,Textured softgels and method and apparatus for the manufacture thereof ,R.P. Scherer Corporation,"Ovila Bezaire, Edward A. Mendelin, Robert Morisette, Michael Ratko, Daniel A. Tedder",1989-01-26,1990-01-23,1993-10-14,1993-10-14,https://patents.google.com/patent/AU642136B2/en,
US-6387400-B1,Process for preparing pharmaceutical compositions for use with soft gelatin formulations ,"R.P. Scherer Technologies, Inc.","Stephen Charles Tindal, Christopher Clive Webster, Josephine Christine Ferdinando, Jacqueline Carol Lewis",2000-08-29,2000-08-29,2002-05-14,2002-05-14,https://patents.google.com/patent/US6387400B1/en,
US-6884060-B2,Apparatus for manufacturing encapsulated products ,"R.P. Scherer Technologies, Inc.","Keith Tanner, Steve Burnett, David Walker, Peter Beke, Norman Stroud, Mani Sundararajan",2001-11-02,2001-11-02,2005-04-26,2005-04-26,https://patents.google.com/patent/US6884060B2/en,https://patentimages.storage.googleapis.com/4f/69/b6/87c9a5a5796080/US06884060-20050426-D00000.png
US-6990791-B2,Encapsulation machine with valved injection wedge ,"R.P. Scherer Technologies, Inc.","Keith Tanner, Robert P. Waranis",2001-11-02,2004-04-09,2006-01-31,2006-01-31,https://patents.google.com/patent/US6990791B2/en,https://patentimages.storage.googleapis.com/US6990791B2/US06990791-20060131-D00000.png
AU-2517095-A,Solutions of aryl or heteroaryl substituted alkanoic acids in lipophilic solvents and soft gelatin capsules containing such solutions ,R.P. Scherer International Corporation,"Rickey S Shelley, Youching Wei",1994-05-19,1995-05-19,1995-12-18,,https://patents.google.com/patent/AU2517095A/en,
US-3269088-A,Apparatus for making fluid filled capsules ,Scherer Corp R P,Alfred W Kath,1963-09-09,1963-09-09,1966-08-30,1966-08-30,https://patents.google.com/patent/US3269088A/en,https://patentimages.storage.googleapis.com/61/fb/f3/66d9bd8a4f4c8d/US3269088-drawings-page-1.png
US-2562129-A,Hypodermic syringe ,Scherer Corp R P,"Robert P Scherer, Scherer John Otto, Walter W Rick",1946-01-23,1946-01-23,1951-07-24,1951-07-24,https://patents.google.com/patent/US2562129A/en,https://patentimages.storage.googleapis.com/95/2b/0c/db73eefacdc8ff/US2562129-drawings-page-1.png
US-2688775-A,Method of branding gelatin capsules ,Scherer Corp R P,"Scherer Robert Pauli, Stephen T Moreland",1952-05-03,1952-05-03,1954-09-14,1954-09-14,https://patents.google.com/patent/US2688775A/en,https://patentimages.storage.googleapis.com/6c/65/1d/cfba034f2015f6/US2688775-drawings-page-1.png
ES-2227885-T3,Vaccine composition for oral administration solid dispersion. ,R.P. Scherer Corporation,Harry Seager,1997-10-27,1998-10-27,2005-04-01,2005-04-01,https://patents.google.com/patent/ES2227885T3/en,
GB-9526150-D0,Ophthalmic treatment ,Scherer Corp R P,,1995-12-21,1995-12-21,1996-02-21,,https://patents.google.com/patent/GB9526150D0/en,
US-2007205127-A1,Peelable pouch containing a single film dosage and process of making same ,"R.P. Scherer Technologies, Inc.","David Barndt, Michael Bergey, Victor Gherdan",2006-03-06,2006-03-06,2007-09-06,,https://patents.google.com/patent/US20070205127A1/en,https://patentimages.storage.googleapis.com/fe/5f/63/6d57114db857cc/US20070205127A1-20070906-D00000.png
US-5529767-A,Printed shaped bodies and sheets containing gelatin ,R. P. Scherer Corporation,"Werner Brox, Peter Block, Reiner Schafer",1992-07-03,1995-06-05,1996-06-25,1996-06-25,https://patents.google.com/patent/US5529767A/en,
CA-2328945-C,Softgel-compatible composition containing retinol ,"Advanced Polymer Systems, Inc., Marie A. Rinaldi, Paul C. Tutschek, Subhash J. Saxena, R.P. Scherer Corporation","Marie A. Rinaldi, Paul C. Tutschek, Subhash J. Saxena",1998-04-17,1999-04-16,2007-07-03,2007-07-03,https://patents.google.com/patent/CA2328945C/en,
CA-2149653-C,Methods and compositions for dispensing fragrances ,"Frank S. S. Morton, Pilar P. Duque, Timothy B. Chiprich, Norman S. Stroud, R.P. Scherer Corporation","Frank S. S. Morton, Pilar P. Duque, Timothy B. Chiprich, Norman S. Stroud",1993-10-01,1994-09-30,1999-02-23,1999-02-23,https://patents.google.com/patent/CA2149653C/en,
US-7331460-B2,Shielded medicament package ,"R.P. Scherer Technologies, Inc.","David R. Barndt, Dennis H. Chadwick, Victor Gherdan, Jr.",2006-01-04,2006-01-04,2008-02-19,2008-02-19,https://patents.google.com/patent/US7331460B2/en,https://patentimages.storage.googleapis.com/ab/bd/47/b05b5b632f697d/US07331460-20080219-D00004.png
US-2902994-A,Hypo jet injector ,Scherer Corp R P,Scherer Robert Pauli,1949-05-21,1953-09-28,1959-09-08,1959-09-08,https://patents.google.com/patent/US2902994A/en,https://patentimages.storage.googleapis.com/66/d1/87/d0a7a41f44c225/US2902994-drawings-page-1.png
US-7121822-B2,Apparatus for making embossed blister pack ,R.P. Scherer Corporation,Kenneth Heath,1998-08-14,2002-02-13,2006-10-17,2006-10-17,https://patents.google.com/patent/US7121822B2/en,https://patentimages.storage.googleapis.com/US7121822B2/US07121822-20061017-D00000.png
US-7758553-B2,Drop dispenser for the delivery of uniform droplets of viscous liquids ,"Insight Vision Incorporated, R.P. Scherer Technologies, Inc.","Patrick Poisson, Lyle M. Bowman",2006-04-03,2006-04-03,2010-07-20,2010-07-20,https://patents.google.com/patent/US7758553B2/en,https://patentimages.storage.googleapis.com/f0/6e/1f/d6c9745ede7f24/US07758553-20100720-D00000.png
US-5819953-A,Method and apparatus for sorting capsules ,R. P. Scherer Gmbh,"Klaus Julius, Christoph Bagusche",1992-06-26,1993-06-16,1998-10-13,1998-10-13,https://patents.google.com/patent/US5819953A/en,https://patentimages.storage.googleapis.com/71/b2/b8/254d24b69f165c/US5819953-drawings-page-2.png
AU-727228-B2,Gelatin encapsulation techniques ,R.P. Scherer Corporation,"Neil John Holland, George Bernard Tidy",1997-03-20,1998-03-19,2000-12-07,2000-12-07,https://patents.google.com/patent/AU727228B2/en,
US-2004235173-A1,Production of host cells containing multiple integrating vectors by serial transduction ,"Gala Design, Inc.","Gregory Bleck, Robert Bremel, Linda Miller",2000-07-03,2004-01-16,2004-11-25,,https://patents.google.com/patent/US20040235173A1/en,https://patentimages.storage.googleapis.com/7b/5b/cb/b01c42447dfa87/US20040235173A1-20041125-D00001.png
US-3258115-A,Two-piece hard gelatin capsule ,Scherer Corp R P,Alfred W Kath,1965-05-12,1965-05-12,1966-06-28,1966-06-28,https://patents.google.com/patent/US3258115A/en,https://patentimages.storage.googleapis.com/ed/95/d6/2b8897e5fa0d55/US3258115-drawings-page-1.png
US-3167067-A,Rotary distributor for pressure cuff tourniquets ,Scherer Corp R P,Henry J Rand,1962-07-24,1962-07-24,1965-01-26,1965-01-26,https://patents.google.com/patent/US3167067A/en,https://patentimages.storage.googleapis.com/b9/5d/52/5d5f1b10fd8b5b/US3167067-drawings-page-1.png
US-2004038304-A1,Antibody libraries ,"Gala Design, Inc.","Robert Bremel, Kurt Eakle, Michael Imboden",2002-03-28,2003-03-27,2004-02-26,,https://patents.google.com/patent/US20040038304A1/en,https://patentimages.storage.googleapis.com/45/61/f9/e686fc1b0d0e51/US20040038304A1-20040226-D00001.png
US-4764383-A,Soft homogenous fish bait ,"Michael Drebot, Nova Scotia Department Of Fisheries, R. P. Scherer Corportion","Sherwin R. Brown, Michael Drebot",1985-10-21,1987-04-09,1988-08-16,1988-08-16,https://patents.google.com/patent/US4764383A/en,
US-2671347-A,Latch structure ,Scherer Corp R P,Scherer Robert Pauli,1950-06-24,1950-06-24,1954-03-09,1954-03-09,https://patents.google.com/patent/US2671347A/en,https://patentimages.storage.googleapis.com/bd/2e/c8/6e01be1c0971b3/US2671347-drawings-page-1.png
US-2688968-A,Hypo jet ampoule ,Scherer Corp R P,Scherer Robert Pauli,1949-05-14,1949-05-14,1954-09-14,1954-09-14,https://patents.google.com/patent/US2688968A/en,https://patentimages.storage.googleapis.com/5c/3c/06/336c0ad450d2fc/US2688968-drawings-page-1.png
US-2002004069-A1,Discoloration-resistant vitamin composition ,"Oppenheim Richard Charles, Truong Hung Cam","Richard Oppenheim, Hung Truong",1997-11-06,2000-05-04,2002-01-10,,https://patents.google.com/patent/US20020004069A1/en,
US-D362390-S,Hermetically sealed vial ,"Automatic Liquid Packaging, Inc.",Gerhard H. Weiler,1994-06-02,1994-06-02,1995-09-19,1995-09-19,https://patents.google.com/patent/USD362390S/en,https://patentimages.storage.googleapis.com/pages/USD362390-1.png
EP-0152292-A2,Acetaminophen gelatin capsules ,R.P. Scherer Corporation,"Garnell A. Rogers, Jr.",1984-02-08,1985-02-08,1985-08-21,,https://patents.google.com/patent/EP0152292A2/en,
US-2623700-A,Disintegrating device ,Scherer Corp R P,Scherer Robert Pauli,1949-02-21,1949-02-21,1952-12-30,1952-12-30,https://patents.google.com/patent/US2623700A/en,https://patentimages.storage.googleapis.com/0c/d1/c4/129059b96d3daa/US2623700-drawings-page-1.png
US-5897874-A,Expulsion of material from a delivery device ,R. P. Scherer Corporation,"Howard Norman Ernest Stevens, Abdul Rashid, Massoud Bakhshaee, Julie Stephanie Binns, Christopher Jon Miller",1993-12-23,1994-12-22,1999-04-27,1999-04-27,https://patents.google.com/patent/US5897874A/en,https://patentimages.storage.googleapis.com/61/c7/29/eed83401b3152f/US5897874-drawings-page-2.png
CA-2284034-C,Comestible capsules having flavoured coatings ,"R.P. Scherer Corporation, Dennis Rowe, Kelvin Royce Garnett, Kate Hale","Dennis Rowe, Kelvin Royce Garnett, Kate Hale",1997-03-25,1998-03-25,2004-09-21,2004-09-21,https://patents.google.com/patent/CA2284034C/en,
CA-1045547-A,"Capsule, especially for medicaments ","Erwin Schwarz, R. P. Scherer Corporation",Erwin Schwarz,1974-06-12,1975-06-11,1979-01-02,1979-01-02,https://patents.google.com/patent/CA1045547A/en,
AU-718421-B2,Method and apparatus for printing a ribbon for packaging gelatin capsules ,"R.P. Scherer Technologies, Inc.","Geoffrey Joseph Cruttenden, Neil John Holland, Dennis Rowe, George Bernard Tidy",1996-03-20,1997-03-20,2000-04-13,2000-04-13,https://patents.google.com/patent/AU718421B2/en,
ES-374925-A1,Process for the preparation of gelatin capsules. ,Scherer Corp R P,,1968-12-27,1969-12-26,1972-02-16,,https://patents.google.com/patent/ES374925A1/en,
AU-2038300-A,Inhalation powders ,"R.P. Scherer, Inc.",Jonathan Kenneth Embleton,1998-12-04,1999-12-03,2000-06-26,,https://patents.google.com/patent/AU2038300A/en,
US-5246635-A,Method and apparatus for the manufacture of textured softgels ,R. P. Scherer Corporation,"Michael Ratko, Ovila Bezaire, Robert Morissette, Edward A. Mendelin, deceased, legal representative Tony Mendelin, Daniel A. Tedder, deceased, legal representative John H. Kornegay",1989-01-26,1993-01-12,1993-09-21,1993-09-21,https://patents.google.com/patent/US5246635A/en,https://patentimages.storage.googleapis.com/ea/fe/dd/f483f203a2c562/US5246635-drawings-page-2.png
US-2780355-A,Gelatin capsule containing water soluble substances ,Scherer Corp R P,"Blasey T Palermo, John P Stanley",1953-11-09,1953-11-09,1957-02-05,1957-02-05,https://patents.google.com/patent/US2780355A/en,
US-4406896-A,Adjuvants for rectal delivery of drug substances ,"Merck & Co., Inc.","Takeru Higuchi, Toshiaki Nishihata, Howard J. Rytting",1979-12-20,1981-06-25,1983-09-27,1983-09-27,https://patents.google.com/patent/US4406896A/en,
CA-1236020-A,Gelatin capsule and method and apparatus for ultrasonically welding thereof ,"Scherer (R.P.) Corporation, Joseph A. Pace, Ladislav J. Vostrovsky","Joseph A. Pace, Ladislav J. Vostrovsky",1983-09-16,1984-09-14,1988-05-03,1988-05-03,https://patents.google.com/patent/CA1236020A/en,
US-2623494-A,Capsule banding machine ,Scherer Corp R P,Scherer Robert Pauli,1950-03-25,1950-03-25,1952-12-30,1952-12-30,https://patents.google.com/patent/US2623494A/en,https://patentimages.storage.googleapis.com/ac/fe/39/398b6bc3b18bcf/US2623494-drawings-page-1.png
AU-686293-B2,Soft gelatin capsules containing particulate material ,R.P. Scherer Corporation,Dennis Rowe,1993-12-20,1994-12-20,1998-02-05,1998-02-05,https://patents.google.com/patent/AU686293B2/en,
US-2597986-A,Method for making containers ,Scherer Corp R P,Richard L Halstead,1950-04-10,1950-04-10,1952-05-27,1952-05-27,https://patents.google.com/patent/US2597986A/en,https://patentimages.storage.googleapis.com/3e/6e/71/3d4fa779d83f58/US2597986-drawings-page-1.png
US-3167071-A,Apparatus for administering intradermal injections ,Scherer Corp R P,Venditty Anthony,1961-07-17,1961-07-17,1965-01-26,1965-01-26,https://patents.google.com/patent/US3167071A/en,https://patentimages.storage.googleapis.com/2b/b6/34/6a186f0edab644/US3167071-drawings-page-1.png
US-2714887-A,Intradermal injector ,Scherer Corp R P,Venditty Anthony,1954-04-26,1954-04-26,1955-08-09,1955-08-09,https://patents.google.com/patent/US2714887A/en,https://patentimages.storage.googleapis.com/bd/3a/a0/3b9d0ab38ebc32/US2714887-drawings-page-1.png
US-2877563-A,Apparatus for drying gelatin capsules ,Scherer Corp R P,Scherer Robert Pauli,1955-04-18,1957-11-29,1959-03-17,1959-03-17,https://patents.google.com/patent/US2877563A/en,https://patentimages.storage.googleapis.com/67/a9/26/ee3dc456741be4/US2877563-drawings-page-1.png
US-5837287-A,Process for preparing solid pharmaceutical dosage forms ,R P Scherer Corporation,"Richard J. Yarwood, Patrick Kearney, Andrew R. Thompson",1994-10-28,1995-05-09,1998-11-17,1998-11-17,https://patents.google.com/patent/US5837287A/en,
US-7704583-B2,Embossed blister pack ,"R.P.Scherer Technologies, Inc.",Kenneth Heath,1998-08-14,2005-04-25,2010-04-27,2010-04-27,https://patents.google.com/patent/US7704583B2/en,https://patentimages.storage.googleapis.com/US7704583B2/US07704583-20100427-D00000.png
US-6596312-B1,Hydrolyzed cellulose granulations of salts of drugs ,"R.P. Scherer Technologies, Inc.","David F. Erkoboni, Ronald S. Vladyka, Jr., Christopher A. Sweriduk, Andrew J. Favara",1999-09-29,2000-09-26,2003-07-22,2003-07-22,https://patents.google.com/patent/US6596312B1/en,https://patentimages.storage.googleapis.com/1e/bb/3a/2758eb2771e658/US06596312-20030722-D00000.png
US-2823868-A,Method and apparatus for comminuting suspensions of solid material ,Scherer Corp R P,John O Scherer,1954-12-06,1954-12-06,1958-02-18,1958-02-18,https://patents.google.com/patent/US2823868A/en,https://patentimages.storage.googleapis.com/c7/0b/5a/2280c9c1ac4909/US2823868-drawings-page-1.png
US-3625213-A,Dispenser with rupturing means ,Scherer Corp R P,Frank E Brown,1969-09-22,1969-09-22,1971-12-07,1971-12-07,https://patents.google.com/patent/US3625213A/en,https://patentimages.storage.googleapis.com/06/14/67/4eda364d09f217/US3625213-drawings-page-2.png
US-2816544-A,Hypodermic injector ,Scherer Corp R P,"Scherer Robert Panli, Venditty Anthony",1954-07-12,1954-07-12,1957-12-17,1957-12-17,https://patents.google.com/patent/US2816544A/en,https://patentimages.storage.googleapis.com/fe/4a/a6/40d3c338924abb/US2816544-drawings-page-1.png
GB-9223146-D0,Vented capsule ,Scherer Corp R P,,1992-11-05,1992-11-05,1992-12-16,,https://patents.google.com/patent/GB9223146D0/en,
US-2596176-A,Method of forming stripes on capsules and the like ,Scherer Corp R P,Scherer Robert Pauli,1948-05-18,1948-05-18,1952-05-13,1952-05-13,https://patents.google.com/patent/US2596176A/en,https://patentimages.storage.googleapis.com/5d/02/d4/dce3f6c7cb42b5/US2596176-drawings-page-1.png
EP-0031561-B1,A rectally administered suppository comprising a drug and an adjuvant ,"Merck &amp; Co., Inc.","Toshiaki Nishihata, Howard J. Rytting, Takeru Higuchi",1979-12-20,1980-12-19,1985-04-10,1985-04-10,https://patents.google.com/patent/EP0031561B1/en,https://patentimages.storage.googleapis.com/65/ea/ab/d56b55bb6db070/imgf0001.png
AU-734179-B2,Polyoxyalkylene glycol gelatin capsule fill formulations comprising crosslinked carboxylic copolymers ,R.P. Scherer Corporation,"Ronnie E. Bayless, Dennis Laba, William Reynolds",1997-07-17,1998-07-15,2001-06-07,2001-06-07,https://patents.google.com/patent/AU734179B2/en,
US-6726928-B2,Process for preparing solid dosage forms for unpalatable pharmaceuticals ,"R.P. Scherer Technologies, Inc.","Richard J. Yarwood, Patrick Kearney, Andrew R. Thompson",1994-10-28,2000-04-18,2004-04-27,2004-04-27,https://patents.google.com/patent/US6726928B2/en,
US-9241902-B2,Chewable soft capsules containing ungelatinized starch ,"R.P. Scherer Technologies, Llc","Dennis Rowe, Kelvin Royce Garnett",2003-12-17,2003-12-17,2016-01-26,2016-01-26,https://patents.google.com/patent/US9241902B2/en,https://patentimages.storage.googleapis.com/89/3a/34/578f5212f1fb47/US09241902-20160126-D00001.png
US-2682253-A,Color banding machine for cylindrical objects ,Scherer Corp R P,"Scherer Robert Pauli, Stephen T Moreland",1952-03-15,1952-03-15,1954-06-29,1954-06-29,https://patents.google.com/patent/US2682253A/en,https://patentimages.storage.googleapis.com/b5/a5/ec/3850f693f0e77e/US2682253-drawings-page-1.png
