search URL:,https://patents.google.com/?assignee=IGNYTA+INC
id,title,assignee,inventor/author,priority date,filing/creation date,publication date,grant date,result link,representative figure link
AU-2012339640-B2,Uracil derivatives as AXL and c-MET kinase inhibitors ,"Ignyta, Inc.","Reddeppareddy Dandu, Robert L. Hudkins, Kurt A. Josef, Catherine P. Prouty, Rabindranath Tripathy",2011-11-14,2012-11-14,2017-01-05,2017-01-05,https://patents.google.com/patent/AU2012339640B2/en,
US-2015283132-A1,Molecules for administration to ros1 mutant cancer cells ,"Ignyta, Inc., Nerviano Medical Sciences S.R.I.","Jonathan Lim, Elena Ardini, Maria Menichincheri",2014-02-20,2015-02-17,2015-10-08,,https://patents.google.com/patent/US20150283132A1/en,https://patentimages.storage.googleapis.com/93/44/9a/beec2f284ea36f/US20150283132A1-20151008-D00001.png
US-9896446-B2,Azaquinazoline inhibitors of atypical protein kinase C ,Cancer Research Technology Limited,"Henry J. Breslin, Bruce D. Dorsey, Benjamin J. Dugan, Robert L. Hudkins, Eugen F. Mesaros, Gregory R. Ott, Craig A. Zificsak, Allison L. Zulli, Ming Tao, Katherine M. Fowler, Emma L. Morris, Gregoire A. Pave, Jonathan R. A. Roffey, Nathaniel J. T. Monck, Christelle N. Soudy, Ikeoluwa Olowoye",2012-09-28,2015-12-18,2018-02-20,2018-02-20,https://patents.google.com/patent/US9896446B2/en,
US-9604994-B2,Thienopyrimidine inhibitors of atypical protein kinase C ,Cancer Research Technology Limited,"Bruce D Dorsey, Keith S. Learn, Emma L. Morris, Gregory R Ott, Jonathan R. A. Roffey, Christelle N. Soudy, Jason C. Wagner",2011-11-23,2014-05-22,2017-03-28,2017-03-28,https://patents.google.com/patent/US9604994B2/en,
US-2018177792-A1,Compositions and methods for treating patients with rtk mutant cells ,"Ignyta, Inc.",Ge Wei,2015-05-29,2016-05-25,2018-06-28,,https://patents.google.com/patent/US20180177792A1/en,https://patentimages.storage.googleapis.com/7d/de/39/9a3bf8cd8860fc/US20180177792A1-20180628-D00001.png
US-9913827-B2,Bendamustine derivatives and methods of using same ,"Ignyta, Inc.","Roger P. Bakale, Peter D. Brown, Jian Chen, Anthony S. Drager, Rachel Y. LaBell, Robert E. McKean, Piyush R. Patel, Renee C. Roemmele",2012-11-12,2017-03-10,2018-03-13,2018-03-13,https://patents.google.com/patent/US9913827B2/en,https://patentimages.storage.googleapis.com/87/11/c5/4ba6f3cb2406c8/US09913827-20180313-D00001.png
US-10028956-B2,Methods of treating various cancers using an AXL/cMET inhibitor in combination with other agents ,"Ignyta, Inc.","Thelma S. Angeles, Mark A. Ator, Mangeng M. Cheng, Bruce Dorsey, Robert L. Hudkins, Bruce A. Ruggeri",2013-08-02,2014-07-31,2018-07-24,2018-07-24,https://patents.google.com/patent/US10028956B2/en,https://patentimages.storage.googleapis.com/f2/e5/73/678787f2bf944b/US10028956-20180724-D00001.png
US-10085979-B2,Combinations for the treatment of neuroblastoma ,"Ignyta, Inc.","Zachary Dolph Hornby, Gang Li, David Wesley Anderson, Garrett M. Brodeur, Radhika Iyer",2014-12-02,2015-11-30,2018-10-02,2018-10-02,https://patents.google.com/patent/US10085979B2/en,https://patentimages.storage.googleapis.com/6f/39/6d/20999b22a30ce4/US10085979-20181002-D00001.png
EP-3087070-B1,"Pyrazolo[1,5-a]pyridine derivatives and methods of their use ","Ignyta, Inc.","Robert L. Hudkins, Allison L. Zulli",2013-12-26,2014-12-18,2017-11-08,2017-11-08,https://patents.google.com/patent/EP3087070B1/en,
AU-2016204294-B9,Solid State Forms Of A Quinazoline Derivative And Its Use As A BRAF Inhibitor ,"Ignyta, Inc.","Stephen J. Bierlmaier, Ralph C. Haltiwanger, Martin J. Jacobs",2013-03-11,2016-06-23,2017-09-21,2017-09-21,https://patents.google.com/patent/AU2016204294B9/en,
KR-20180096621-A,Combination for the treatment of cancer ,"이그니타, 인코포레이티드","강 리, 제 웨이, 자카리 디. 호른비, 조나단 에-렌 림",2015-12-18,2016-12-15,2018-08-29,,https://patents.google.com/patent/KR20180096621A/en,https://patentimages.storage.googleapis.com/c9/12/0c/74d197d973509b/pct00022.png
US-2017356918-A1,Multiplexed immunohistochemistry assays for diagnosis and treatment of cancer ,"Ignyta, Inc.","Jason Hans CHRISTIANSEN, Danielle Anthea MURPHY, Aaron Scott BOOMER, Jennifer Lyn LAMOUREUX",2014-12-03,2015-12-01,2017-12-14,,https://patents.google.com/patent/US20170356918A1/en,https://patentimages.storage.googleapis.com/91/c9/44/57598470890bd5/US20170356918A1-20171214-D00000.png
US-2019022089-A1,Pharmaceutical compositions and dosage forms ,"Ignyta, Inc.","Daniel CODALLOS, JR., Robert Orr, Ching-Yuan Li, Valerie Denise START",2017-07-19,2018-07-18,2019-01-24,,https://patents.google.com/patent/US20190022089A1/en,https://patentimages.storage.googleapis.com/66/31/4b/85a1b10eb9de5f/US20190022089A1-20190124-D00000.png
US-2018256570-A1,Topical formulations ,"Ignyta, Inc.","Jeffrey Alan Peterson, Stephanie Ann Sweetana",2015-11-30,2016-11-28,2018-09-13,,https://patents.google.com/patent/US20180256570A1/en,https://patentimages.storage.googleapis.com/64/42/ac/fff69d256a5064/US20180256570A1-20180913-D00000.png
WO-2014036314-A2,"Diagnosis of rheumatoid arthritis (ra) using differentially methylated loci identified in peripheral blood mononuclear cells, t-cells, b-cells and monocytes ","Ignyta, Inc.","Jonathan Lim, Robert Shoemaker, Louis Bookbinder, David Anderson",2012-08-31,2013-08-29,2014-03-06,,https://patents.google.com/patent/WO2014036314A2/en,
US-2015274720-A1,Azaquinazoline Inhibitors Of Atypical Protein Kinase C ,"Ignyta, Inc., Cancer Research Technology Limited","Bruce D. Dorsey, Benjamin J. Dugan, Katherine M. Fowler, Robert L. Hudkins, Eugen F. Mesaros, Nathaniel JT Monck, Emma L. Morris, Ikeoluwa Olowoye, Gregory R. Ott, Gregoire A. Pave, Jonathan R.A. Roffey, Christelle N. Soudy, Craig A. Zificsak, Allison L. Zulli",2014-03-25,2015-03-25,2015-10-01,,https://patents.google.com/patent/US20150274720A1/en,
WO-2014008426-A2,Diagnosis of systemic lupus erythematosus ,"Ignyta, Inc.","Jonathan Lim, Robert Shoemaker, Louis Bookbinder, David Anderson",2012-07-06,2013-07-03,2014-01-09,,https://patents.google.com/patent/WO2014008426A2/en,
WO-2014189787-A2,Compositions and methods for the determination of methylation status ,"Ignyta, Inc.","Jonathan Lim, Kurt KRUMMEL, Robert Shoemaker, Zachary HORNBY",2013-05-20,2014-05-16,2014-11-27,,https://patents.google.com/patent/WO2014189787A2/en,
WO-2015199939-A1,Compositions and methods for amplifying and determining nucleic acid sequences ,"Ignyta, Inc.","Robert Shoemaker, Anthony P. Shuber",2014-06-26,2015-06-04,2015-12-30,,https://patents.google.com/patent/WO2015199939A1/en,
WO-2018039275-A1,Combinations for the treatment of cancer ,"Ignyta, Inc.",Eric Santos MARTIN,2016-08-24,2017-08-22,2018-03-01,,https://patents.google.com/patent/WO2018039275A1/en,
EP-3490561-A1,Combinations for the treatment of cancer ,"Ignyta, Inc.","Eric Santos MARTIN, Yumi Yokoyama",2016-08-01,2017-07-28,2019-06-05,,https://patents.google.com/patent/EP3490561A1/en,
WO-2019077506-A1,Pharmaceutical compositions and dosage forms ,"Ignyta, Inc.","Robert Orr, Kathryn Emily Columbo PUGH, Matthew Jarud SHAFFER, Brent Antone UHRIG, Edward Dennis Lachapelle, Charlie Michael MCLAUGHLIN",2017-10-17,2018-10-16,2019-04-25,,https://patents.google.com/patent/WO2019077506A1/en,
WO-2018102455-A1,Methods for the treatment of cancer ,"Ignyta, Inc.","Jonathan Ee-Ren LIM, Pratik S. Multani, Richard LANDIN, Rupal A. PATEL, Jennifer Wright OLIVER",2016-12-01,2017-11-29,2018-06-07,,https://patents.google.com/patent/WO2018102455A1/en,
